{
  "workflow_id": "file_read_test",
  "version": "1.0",
  "created_by": "test",
  "plan_hash": "03642e3b9804eb0b1816cd03b57175566aec5ec6c48368a73115ac6561927a5d",
  "steps": [
    {
      "id": "step_1",
      "capability": "file_read",
      "inputs": {
        "operation": "file_read",
        "path": "test_input.txt"
      },
      "outputs": [
        "file_content"
      ],
      "idempotent": true,
      "retryable": false,
      "requires_approval": false
    }
  ]
}